{
  "request_id": "req_2026_02_16_001",
  "as_of_date": "2026-02-16",
  "currency": "USD",
  "status": "ok",

  "valuation": {
    "method": "comps_ev_revenue",
    "fair_value": {
      "currency": "USD",
      "point": 5000.0,
      "range": {
        "low": 5000.0,
        "high": 5625.0
      },
      "range_basis": "q25_q75",
      "provenance_node_ids": {
        "point": "prov_fair_value_point",
        "range_low": "prov_fair_value_low",
        "range_high": "prov_fair_value_high"
      }
    }
  },

  "key_inputs": {
    "subject_company_id": "SUBJ-001",
    "subject_revenue_ltm": 500.0,
    "selected_comp_count": 3,
    "raw_multiples": [10.0, 11.25, 10.0],
    "adjusted_multiples": [10.0, 10.0, 11.25],
    "quantile_method": "nearest_rank",
    "multiple_low": 10.0,
    "median_multiple": 10.0,
    "multiple_high": 11.25
  },

  "assumptions_used": [
    { "id": "asm_outlier_policy", "name": "outlier_policy", "value": "winsorize" },
    { "id": "asm_outlier_quantile", "name": "outlier_quantile", "value": 0.1 },
    { "id": "asm_quantile_method", "name": "quantile_method", "value": "nearest_rank" }
  ],

  "sources": [
    {
      "id": "src_mock_v1",
      "provider": "mock_v1",
      "dataset": "mock_comps_snapshot",
      "dataset_version": "2026-02-16",
      "dataset_hash": "sha256:placeholder",
      "citation": "Mock comps dataset — loosely inspired by publicly traded software companies (figures are illustrative, not real market data)"
    }
  ],

  "comps_selection_result": {
    "requested": {
      "universe": "global_software",
      "filters": {
        "sector": ["Application Software"],
        "size": ["mid"],
        "industry_keywords": ["software"],
        "geographies": ["US", "CA"],
        "revenue_band": { "min": 200.0, "max": 1000.0 }
      },
      "max_comps": 5,
      "sort_key": ["ticker", "company_id"]
    },
    "dataset_universe": "global_software",
    "sort_key_used": ["ticker", "company_id"],
    "matched_before_limit": 3,
    "included_count": 3,
    "included_company_ids": ["COMP-006", "COMP-010", "COMP-003"],
    "match_details": [
      {
        "company_id": "COMP-006",
        "ticker": "HUBS",
        "included": true,
        "matched_filters": { "universe": true, "sector": true, "size": true, "industry_keywords": true, "geographies": true, "revenue_band": true, "ev_positive": true },
        "excluded_reason": null,
        "selection_rank": 1
      },
      {
        "company_id": "COMP-010",
        "ticker": "SHOP",
        "included": true,
        "matched_filters": { "universe": true, "sector": true, "size": true, "industry_keywords": true, "geographies": true, "revenue_band": true, "ev_positive": true },
        "excluded_reason": null,
        "selection_rank": 2
      },
      {
        "company_id": "COMP-003",
        "ticker": "WDAY",
        "included": true,
        "matched_filters": { "universe": true, "sector": true, "size": true, "industry_keywords": true, "geographies": true, "revenue_band": true, "ev_positive": true },
        "excluded_reason": null,
        "selection_rank": 3
      },
      {
        "company_id": "COMP-001",
        "ticker": "CRM",
        "included": false,
        "matched_filters": { "universe": true, "sector": true, "size": false, "industry_keywords": true, "geographies": true, "revenue_band": false, "ev_positive": true },
        "excluded_reason": "filter_size",
        "selection_rank": null
      },
      {
        "company_id": "COMP-002",
        "ticker": "NOW",
        "included": false,
        "matched_filters": { "universe": true, "sector": true, "size": false, "industry_keywords": true, "geographies": true, "revenue_band": false, "ev_positive": true },
        "excluded_reason": "filter_size",
        "selection_rank": null
      },
      {
        "company_id": "COMP-004",
        "ticker": "DDOG",
        "included": false,
        "matched_filters": { "universe": true, "sector": false, "size": true, "industry_keywords": true, "geographies": true, "revenue_band": true, "ev_positive": true },
        "excluded_reason": "filter_sector",
        "selection_rank": null
      },
      {
        "company_id": "COMP-005",
        "ticker": "ZS",
        "included": false,
        "matched_filters": { "universe": true, "sector": false, "size": true, "industry_keywords": true, "geographies": true, "revenue_band": true, "ev_positive": true },
        "excluded_reason": "filter_sector",
        "selection_rank": null
      },
      {
        "company_id": "COMP-007",
        "ticker": "MDB",
        "included": false,
        "matched_filters": { "universe": true, "sector": false, "size": true, "industry_keywords": true, "geographies": true, "revenue_band": true, "ev_positive": true },
        "excluded_reason": "filter_sector",
        "selection_rank": null
      },
      {
        "company_id": "COMP-008",
        "ticker": "NET",
        "included": false,
        "matched_filters": { "universe": true, "sector": false, "size": true, "industry_keywords": true, "geographies": true, "revenue_band": true, "ev_positive": true },
        "excluded_reason": "filter_sector",
        "selection_rank": null
      },
      {
        "company_id": "COMP-009",
        "ticker": "SAP",
        "included": false,
        "matched_filters": { "universe": true, "sector": true, "size": false, "industry_keywords": true, "geographies": false, "revenue_band": false, "ev_positive": true },
        "excluded_reason": "filter_size",
        "selection_rank": null
      },
      {
        "company_id": "COMP-011",
        "ticker": "TEAM",
        "included": false,
        "matched_filters": { "universe": true, "sector": true, "size": true, "industry_keywords": true, "geographies": false, "revenue_band": true, "ev_positive": true },
        "excluded_reason": "filter_geographies",
        "selection_rank": null
      },
      {
        "company_id": "COMP-012",
        "ticker": "ESTC",
        "included": false,
        "matched_filters": { "universe": true, "sector": false, "size": false, "industry_keywords": true, "geographies": false, "revenue_band": false, "ev_positive": true },
        "excluded_reason": "filter_sector",
        "selection_rank": null
      },
      {
        "company_id": "COMP-013",
        "ticker": "CFLT",
        "included": false,
        "matched_filters": { "universe": true, "sector": false, "size": false, "industry_keywords": true, "geographies": true, "revenue_band": false, "ev_positive": true },
        "excluded_reason": "filter_sector",
        "selection_rank": null
      },
      {
        "company_id": "COMP-014",
        "ticker": "BILL",
        "included": false,
        "matched_filters": { "universe": true, "sector": true, "size": false, "industry_keywords": true, "geographies": true, "revenue_band": false, "ev_positive": true },
        "excluded_reason": "filter_size",
        "selection_rank": null
      },
      {
        "company_id": "COMP-015",
        "ticker": "MNDY",
        "included": false,
        "matched_filters": { "universe": true, "sector": true, "size": false, "industry_keywords": true, "geographies": false, "revenue_band": false, "ev_positive": true },
        "excluded_reason": "filter_size",
        "selection_rank": null
      }
    ]
  },

  "provenance": {
    "nodes": [
      {
        "id": "prov_subject_revenue",
        "field_path": "key_inputs.subject_revenue_ltm",
        "formula": "subject_revenue_ltm = request.subject.revenue_ltm (pass-through input)",
        "inputs": { "revenue_ltm": 500.0 },
        "assumption_ids": [],
        "source_ids": [],
        "output": 500.0
      },
      {
        "id": "prov_selected_comps",
        "field_path": "comps_selection_result.included_company_ids",
        "formula": "selected_comps = sort(filter(universe, filters), sort_key)[:max_comps]",
        "inputs": {
          "selection": {
            "universe": "global_software",
            "filters": {
              "sector": ["Application Software"],
              "size": ["mid"],
              "industry_keywords": ["software"],
              "geographies": ["US", "CA"],
              "revenue_band": { "min": 200.0, "max": 1000.0 }
            },
            "max_comps": 5,
            "sort_key": ["ticker", "company_id"]
          }
        },
        "assumption_ids": [],
        "source_ids": ["src_mock_v1"],
        "output": ["COMP-006", "COMP-010", "COMP-003"]
      },
      {
        "id": "prov_raw_multiples",
        "field_path": "key_inputs.raw_multiples",
        "formula": "multiple_i = ev_i / revenue_ltm_i",
        "inputs": {
          "selected_comps": [
            { "company_id": "COMP-006", "ticker": "HUBS", "ev": 3000.0, "revenue_ltm": 300.0 },
            { "company_id": "COMP-010", "ticker": "SHOP", "ev": 9000.0, "revenue_ltm": 800.0 },
            { "company_id": "COMP-003", "ticker": "WDAY", "ev": 7000.0, "revenue_ltm": 700.0 }
          ]
        },
        "assumption_ids": [],
        "source_ids": ["src_mock_v1"],
        "output": [10.0, 11.25, 10.0],
        "parent_ids": ["prov_selected_comps"]
      },
      {
        "id": "prov_adjusted_multiples",
        "field_path": "key_inputs.adjusted_multiples",
        "formula": "adjusted = winsorize(sorted(raw_multiples), quantile=0.1, method=nearest_rank); boundaries [10.0, 11.25]; no values clamped",
        "inputs": {
          "raw_multiples": [10.0, 11.25, 10.0],
          "outlier_policy": "winsorize",
          "outlier_quantile": 0.1,
          "quantile_method": "nearest_rank"
        },
        "assumption_ids": ["asm_outlier_policy", "asm_outlier_quantile", "asm_quantile_method"],
        "source_ids": ["src_mock_v1"],
        "output": [10.0, 10.0, 11.25],
        "parent_ids": ["prov_raw_multiples"]
      },
      {
        "id": "prov_multiple_point",
        "field_path": "key_inputs.median_multiple",